messages,sender_labels,receiver_labels,speakers,receivers,absolute_message_index,relative_message_index,seasons,years,game_score,game_score_delta,players,game_id,sender_bool,receiver_bool,deception_state
"So... which option? I think we can bet that germany won't do that. I think it is definitely the better move. It's just up to how much you trust me. Again, I'm ready to go all the way with this alliance. I think I might diplomatically have Russia in the bag, and be able to Norway back, from which I could get Stp. With me going for russia, and maybe eventually italy, I think we can get a two way win.",False,True,england,france,1068,91,Fall,1902,5,0,"england, france",9,False,True,successful_deception
"Ugh and now I've got to build an army in StP, because of England",True,True,russia,italy,340,30,Winter,1901,5,1,"italy, russia",3,True,True,no_deception
Plan is to convoy norway army to denmark and move NWG to Norway.,True,True,england,russia,471,25,Spring,1902,4,-1,"russia, england",1,True,True,no_deception
I’m in it with you. Just look at my positioning. You have the upper hand over me. If you want to stab you easily can. I’d like to pull off a FG win. Never managed it before.,True,True,germany,france,526,36,Spring,1904,6,-2,"germany, france",8,True,True,no_deception
Are you there kaiserin?,True,True,england,germany,542,63,Fall,1902,5,0,"germany, england",3,True,True,no_deception
Go for Denmark?  Threaten Denmark and maybe bounce in Norway?  Try for either BEL or HOL?,True,True,turkey,england,589,10,Fall,1904,6,2,"england, turkey",8,True,True,no_deception
How does he know your real name?,True,NOANNOTATION,england,germany,2651,345,Spring,1905,6,-3,"germany, england",2,True,,no_deception
"If I convoy Syr to Gre, would you be willing to support me into Greece?",True,True,italy,turkey,418,38,Fall,1903,4,-1,"italy, turkey",8,True,True,no_deception
I will leave you to fight the ottomans.,True,True,england,france,438,53,Fall,1907,6,-3,"england, france",6,True,True,no_deception
"France is moving fleets around Spain and getting in position to stab. Russia is also going to hit Germany from the east. If you keep attacking Germany’s north, you’ll gain Denmark and lose Yor etc. I’m bringing this up because I have an interest in Germany living, but at this point, so do you.",True,True,austria,england,522,23,Fall,1902,4,0,"austria, england",7,True,True,no_deception
"Interesting.  I've never seen that before  and would love to hear your thoughts on it.  Though, I assume you mean bump Venice.",True,True,turkey,austria,51,9,Spring,1901,3,0,"austria, turkey",8,True,True,no_deception
"Alright, that’s a valid reason.
I was feeling more urgent about it because I think it’s paramount that Russia get some aid against Austria.",True,True,germany,england,1268,226,Fall,1905,5,0,"germany, england",1,True,True,no_deception
Perfect!,True,True,germany,england,1546,368,Fall,1906,7,0,"germany, england",3,True,True,no_deception
"You've got a lot of really easy paths to expansion that don't go through me, and I've got a lot of paths to expansion that don't go through you. Plus, you've got a friendship going with France, and there's a German right between us that we can definitely handle together, to our mutual long-term benefit.",True,True,russia,england,615,60,Fall,1902,5,0,"russia, england",3,True,True,no_deception
What are you thinking?,True,True,germany,england,961,172,Spring,1904,5,-1,"germany, england",3,True,True,no_deception
"But yeah sorry about that, I had put that in as my orders and then forgot to change them",False,False,france,germany,372,94,Spring,1904,7,1,"germany, france",6,False,False,successful_deception
Sorry your majesty I was sleeping,True,True,turkey,england,540,40,Fall,1902,4,-1,"england, turkey",3,True,True,no_deception
But...how's he going to get there?,True,True,russia,turkey,528,50,Spring,1904,5,-1,"russia, turkey",8,True,True,no_deception
"I've been informed that Germany and England will be moving against me this turn, unfortunately. I'm going to move RUM-BUD, all other moves will be heading North.",True,True,russia,turkey,275,18,Fall,1902,7,3,"russia, turkey",6,True,True,no_deception
I agree,True,True,england,italy,1417,71,Fall,1902,5,1,"italy, england",2,True,True,no_deception
"Less a real alliance and more being a thought partner - I'm happy to talk to anyone, after all",True,True,france,russia,808,117,Fall,1902,5,-1,"russia, france",9,True,True,no_deception
Italy seems committed to avoiding Tyr. Do you have any interest in working with them against Turkey?,True,True,germany,austria,123,7,Spring,1901,3,0,"germany, austria",10,True,True,no_deception
"Do you 
1. want to shift down into Bul with me supporting Ukr into Bul
2. Shift up into Bul? With me trying to maneuver towards War?

Whatever you do, France is building up towards you. A deliberate bounce in Pie might not be a bad choice because it’ll give you time to secure the Med next year",True,True,austria,italy,802,102,Spring,1906,4,-3,"italy, austria",7,True,True,no_deception
Oh .... i don't think that's salvageable.  But ... maybe?,True,True,turkey,italy,485,61,Winter,1903,6,3,"italy, turkey",8,True,True,no_deception
Im talking with them but unsure right now. I got myself in a bind when I fell asleep the other night when negotiating with Austria and they moved toward me. I hope they’ll draw back and choose to go after Russia or Italy next but I doubt it’ll be Russia based on their collaboration to finish Turkey off faster.,True,True,germany,england,547,86,Fall,1903,6,0,"germany, england",10,True,True,no_deception
"Hi, I am willing to work with you, at least in the intel sharing part. I would be happy if we split Rum and Gre in a way that steers us away from each other.",False,True,turkey,austria,158,1,Spring,1901,3,0,"austria, turkey",7,False,True,successful_deception
I won't try from the channel. But I can bring the Nwy fleet around this year.,True,True,england,germany,1100,177,Spring,1905,5,0,"germany, england",1,True,True,no_deception
"It does in principle, yes. It’s after midnight here and I’m heading to bed, but I’ll have a closer look at the map tomorrow (today now!) and give you a fuller response then. Maybe we can plot out some actual moves then. Where was the one unsupported move coming from, so I can run a sandbox tomorrow over coffee?",True,True,italy,france,746,30,Spring,1903,5,0,"italy, france",3,True,True,no_deception
"Greetings!

I was just wondering what your aims were regarding territory in the area? May I suggest that we keep Pie as a DMZ for the time being?",True,True,italy,france,13,0,Spring,1901,3,0,"italy, france",10,True,True,no_deception
thanks for being agreeable,True,True,austria,italy,394,129,Fall,1901,3,0,"italy, austria",2,True,True,no_deception
"That could work! I'm concerned about what MAO would do, but he'll be mainly trying to fight England off I guess.",True,True,italy,germany,1118,87,Fall,1904,5,0,"italy, germany",3,True,True,no_deception
I’m happy with that. As long as we force the disband so we can end this thing 😃,True,True,italy,germany,1823,141,Spring,1908,9,2,"italy, germany",3,True,True,no_deception
"I'd be amenable to that. To be clear, Would you want me to move my fleet to Belgium while your North Sea fleet supports?",True,NOANNOTATION,germany,england,173,10,Fall,1901,3,0,"germany, england",1,True,,no_deception
"It's not that creepy.  If we do AARs, I'll talk about it and my reason for name dropping",True,True,austria,italy,2555,584,Spring,1905,8,2,"italy, austria",2,True,True,no_deception
"That's valid. And actually I was conferring with England and we concluded that it's not really gonna be possible for me to help you take Marseilles this year anyway. 

...what are you and Austria planning for this year, then? I'm willing to tell you my plans in exchange as a gesture of trust. 

Have you communicated at all with England or France?",True,True,germany,italy,426,32,Spring,1902,5,1,"italy, germany",1,True,True,no_deception
Doesn’t seem like it :/,True,True,germany,england,1422,322,Winter,1905,7,0,"germany, england",3,True,True,no_deception
Yeah if that won’t work we can play more cautious.,True,True,england,france,340,33,Fall,1901,3,0,"england, france",7,True,True,no_deception
"Haha- thank you! Didn't realize you were pulling strings behind the scenes, but I really appreciate you doing so.",True,True,france,russia,469,14,Spring,1902,5,0,"russia, france",1,True,True,no_deception
well that's encouraging. Thanks now I can not-be-at-the-gym in peace 😃,True,True,turkey,england,310,21,Fall,1901,3,0,"england, turkey",3,True,True,no_deception
I submitted,True,True,england,austria,2693,104,Spring,1905,6,-2,"austria, england",2,True,True,no_deception
Lol... England just said he's going to Denmark and then stop attacking me.,True,True,germany,france,547,50,Fall,1902,4,-2,"germany, france",7,True,True,no_deception
"Did you have any specific ideas for this season? I think I’ll need Boh to support Munich, and I’m concerned about losing War",True,True,germany,austria,1630,110,Spring,1907,7,3,"germany, austria",3,True,True,no_deception
How so?,True,True,austria,england,2287,74,Spring,1905,8,2,"austria, england",2,True,True,no_deception
Hackenbracht.,True,True,turkey,russia,894,181,Fall,1910,11,1,"russia, turkey",8,True,True,no_deception
From russia? Threat from England may benefit us and allow us to get more territory from turkey when the dust settles.,True,True,austria,italy,351,38,Winter,1901,4,0,"italy, austria",3,True,True,no_deception
"Well, this is fun.  On the bright side, looks like France left his English buddy out to dry, so...where do we go from here?",True,True,russia,germany,297,8,Fall,1902,6,1,"germany, russia",8,True,True,no_deception
Yes,False,True,austria,turkey,202,7,Fall,1901,3,0,"austria, turkey",11,False,True,successful_deception
So I can convoy it to the island in the spring,True,True,germany,russia,1365,114,Fall,1903,5,-2,"germany, russia",9,True,True,no_deception
"If you give me berlin back, I can support you into edi",False,False,russia,turkey,1345,95,Fall,1906,9,3,"russia, turkey",4,False,False,successful_deception
FWIW -> for what it's worth,True,True,france,england,1432,83,Winter,1905,4,-3,"england, france",3,True,True,no_deception
I'm definitely a bit upset about the support into the channel you gave and all of the lying. You didn't need to lie about your moves to amp up the aggression on denmark: I never asked for a full list of moves.,True,True,england,germany,1571,298,Fall,1906,5,0,"germany, england",1,True,True,no_deception
That's very nice Vivian. So glad to hear that!! And yes I took the weekend off to feed into my family,True,True,england,italy,1371,159,Fall,1905,6,0,"italy, england",3,True,True,no_deception
"Okay, go on",True,True,germany,england,1990,394,Spring,1907,7,2,"germany, england",1,True,True,no_deception
I think so too,True,True,france,germany,25,5,Spring,1901,3,0,"germany, france",8,True,True,no_deception
I’m game for a draw if you guys want to wrap it up here.,False,True,italy,austria,2474,146,Spring,1908,13,10,"italy, austria",1,False,True,successful_deception
"I wanted to ask if you knew about Italian intentions. I don't think he plans to move to Piedmont, which could be an indication that you want to play defensively.",False,True,france,austria,52,1,Spring,1901,3,0,"austria, france",4,False,True,successful_deception
"That would bounce in Netherlands if they decided to use the North sea to move, but I'm assuming that you would be convincing them to do the opposite?",False,True,russia,france,812,121,Fall,1902,6,1,"russia, france",9,False,True,successful_deception
But we need to get G and E turned on each other,True,True,austria,italy,2374,555,Spring,1905,8,2,"italy, austria",2,True,True,no_deception
I absolutely did not advise G to build the F Kie.,True,True,italy,england,1858,312,Spring,1907,10,5,"italy, england",1,True,True,no_deception
What is there to gain by continuing to play?,True,True,france,turkey,422,18,Spring,1910,0,0,"turkey, france",5,True,True,no_deception
"Speaking which, need me to get out of the way of your F Alb, or is it staying on your coast for now?",True,True,italy,austria,216,27,Fall,1901,3,0,"italy, austria",3,True,True,no_deception
"Yeah, and I'm retreating to Ser. Thing I gotta worry about is that Boh army walking into Vienna.",True,True,austria,england,1207,36,Spring,1905,7,2,"austria, england",1,True,True,no_deception
"I mean, I feel like it's a pretty big waste of time, because there's a huge tactical momentum advantage to getting your fleet out, but if you insist then we can bounce.",False,True,russia,turkey,89,5,Spring,1901,4,1,"russia, turkey",5,False,True,successful_deception
"Go to hell. Or, Hel, rather. It'll be fun. 😃",True,True,russia,france,569,9,Spring,1904,5,-3,"russia, france",8,True,True,no_deception
God Germany had me so goddamn worried about getting bounced in Sweden and they didn't even twitch toward Denmark this turn ffs,True,True,russia,italy,223,38,Fall,1901,4,1,"italy, russia",9,True,True,no_deception
"Yeah I'm not going for Russia right now. Supposing he can hold the stalemate, he's literally just saving those territories for me to take at a later date. I will get a little annoyed if the admin cuts us off at 1910 though, as I think my endgame is a little past that.",True,True,england,italy,1309,152,Fall,1905,5,-2,"italy, england",1,True,True,no_deception
I see,True,True,england,germany,909,158,Fall,1903,7,3,"germany, england",3,True,True,no_deception
"I mean, the only decision point is Ank/Smy/Con, right?  That's just a matter of choosing the mover - everything else is straightforward one-power tactics",True,True,russia,italy,896,44,Spring,1904,7,1,"italy, russia",1,True,True,no_deception
sneak into Bur*,True,True,england,germany,934,146,Fall,1904,5,1,"germany, england",1,True,True,no_deception
Yes I wasn't questioning that,True,True,france,russia,445,10,Spring,1902,6,1,"russia, france",7,True,True,no_deception
The real trick is keeping Russia busy with Germany for one turn,True,True,austria,italy,416,147,Fall,1901,3,0,"italy, austria",2,True,True,no_deception
Congrats on Tri! I’m going to retreat into Boh,True,True,germany,italy,1577,109,Fall,1906,7,1,"italy, germany",3,True,True,no_deception
Look man I’m not going to shrink myself for you to feel safer. I love our alliance and think it has definitely worked for our mutual benefit. But we never agreed that there was an expectation of parity and even that suggestion makes me weary of a stab from you.,True,True,germany,england,3001,465,Spring,1907,10,2,"germany, england",2,True,True,no_deception
How much of Turkey are you willing to let the Italian have?  I'd like two centers and I'd be comfortable with you having Bulgaria - as long as you were willing to head after Italy next.,True,NOANNOTATION,russia,austria,41,2,Spring,1901,4,1,"austria, russia",7,True,,no_deception
"Ugh, you would hit that right as I was crashing. Let me wake up and check map.",False,True,turkey,germany,324,21,Fall,1903,6,1,"germany, turkey",6,False,True,successful_deception
We could invite all the nations to attend and bear witness to the consummation of our commitment hahaha,False,False,england,germany,681,96,Fall,1902,5,0,"germany, england",3,False,False,successful_deception
"As far as Turkey and Austria goes, I'm inconclusive. Austria doesn't talk much but then again, neither does Turkey.",False,True,russia,france,442,65,Winter,1901,6,1,"russia, france",9,False,True,successful_deception
"Plus, you ever try digging out a talented Italy as Austria? It's a pain in the fuckin neck! :P",True,True,austria,italy,555,27,Winter,1902,5,0,"italy, austria",1,True,True,no_deception
"Same I’m done tomorrow, I’m at MSU",True,True,italy,russia,1145,240,Fall,1902,4,-2,"italy, russia",9,True,True,no_deception
Sounds like their in if you are,True,True,england,france,22,2,Spring,1901,3,0,"england, france",5,True,True,no_deception
Shall we get you Budapest or Munich this year?,False,True,italy,russia,1942,73,Spring,1907,10,5,"italy, russia",1,False,True,successful_deception
"Alright, I've got Gal standing by",False,True,turkey,england,416,54,Spring,1909,11,-1,"england, turkey",5,False,True,successful_deception
"Nice! Have to take some time to think about this tactically but I think we're in a good spot.

 I'm kind of surprised Italy took Trieste, that's statistically a pretty bad move for Italy.",True,True,russia,turkey,75,4,Fall,1901,4,1,"russia, turkey",6,True,True,no_deception
"I'm not moving toward you. If I were, I'd have built a southern fleet.  In fact, I'm grounding the Adriatic fleet away from Ionian",True,NOANNOTATION,turkey,france,458,45,Spring,1908,15,7,"turkey, france",6,True,,no_deception
Austria has been really incommunicado recently and it’s what I would do if I was him,False,True,italy,germany,2053,233,Fall,1904,5,-2,"italy, germany",2,False,True,successful_deception
Yes,True,True,england,russia,1335,119,Fall,1905,6,5,"russia, england",3,True,True,no_deception
"Yeah, I think that’s best this season at least. I think we’ll need Italy’s cooperation against turkey/Austria and don’t want them to turn on us too soon",True,True,germany,england,1001,189,Spring,1904,5,-1,"germany, england",3,True,True,no_deception
"I have been talking with France, and I think i might have actually got him properly scared of Russia to back off of you. I'm waiting to hear back from my latest message, but he will only do it if you actually do help against Russia, something I still dont know if i can trust you on.",False,True,germany,england,732,48,Fall,1903,4,-1,"germany, england",7,False,True,successful_deception
I’ve been trying to think about the stab. I’m not sure it’s the right time now.,True,NOANNOTATION,england,turkey,2863,52,Spring,1906,7,5,"england, turkey",2,True,,no_deception
"Definitely not, but we need to guess perfectly here",True,True,austria,italy,2845,639,Spring,1906,7,0,"italy, austria",2,True,True,no_deception
I agree about the eastern front. I think Greece is fine to move back to help your push.,True,False,austria,italy,917,93,Fall,1903,4,-1,"italy, austria",3,True,False,no_deception
"Well, I’ll see what I can do then. The alternative is that we just duke it out for another couple of years until admin calls it.",True,True,england,italy,2479,453,Spring,1908,6,-7,"italy, england",1,True,True,no_deception
"Agreed, it sounds reasonable.  I just hope that you are reasonable! 🙂",True,True,turkey,italy,385,30,Spring,1903,5,1,"italy, turkey",8,True,True,no_deception
Oh honey no...dots that don’t already belong to you don’t change posession unless occupied going into winter/build phase!,True,NOANNOTATION,france,turkey,309,15,Fall,1902,5,1,"turkey, france",8,True,,no_deception
"Anyways, let me know what you think. I have a final exam this evening, so I probably won't be on again until later this evening, FYI",True,True,italy,austria,517,71,Spring,1904,3,1,"italy, austria",8,True,True,no_deception
"Oh ^^ When did he tell you what we'd been talking about?

Like I said, open book here in Italy!",True,NOANNOTATION,italy,germany,1110,79,Fall,1904,5,0,"italy, germany",3,True,,no_deception
Don't do it,True,True,england,italy,1021,105,Fall,1904,6,1,"italy, england",3,True,True,no_deception
"Yeah, for sure -- I just want to be sure I'm ready to kick Russia out of Sweden asap",False,False,england,germany,152,14,Fall,1901,3,0,"germany, england",5,False,False,successful_deception
Cover or try to take it?,True,True,italy,france,1672,59,Spring,1907,8,4,"italy, france",3,True,True,no_deception
God the Turks ugh,True,True,russia,italy,1353,299,Fall,1903,7,2,"italy, russia",9,True,True,no_deception
"And, frankly, she’s going to be pissed at me after this move, so I wouldn’t mind if you lied to her too at the same time to spread that out a bit.",False,True,italy,england,1842,300,Spring,1907,10,5,"italy, england",1,False,True,successful_deception
"Well, they can't kill the fleet in Belgium and keep Norway at the same time, but then again, if the Germans do as I asked they wouldn't be able to do either even if they prioritized Norway. Germany may not have the upper hand but they still have a decent position.",True,True,russia,italy,497,86,Spring,1902,6,2,"italy, russia",9,True,True,no_deception
Ok so guarantee based on Russian collaboration. So you don't think Russia and Germany are friends anymore? I suppose they don't have many favors to offer one another,True,True,england,france,292,64,Winter,1901,4,-1,"england, france",1,True,True,no_deception
"They told me they are interested in working with me against you and are going to try to take Ser. So what I think we should do is you attack Rum with Bud and Gal, which would cut support and let me take Sev. That way we get two of Turkeys territories, which would be a big blow to them",False,False,russia,austria,1039,20,Spring,1904,6,1,"austria, russia",4,False,False,successful_deception
And dang that would’ve been smart,True,True,italy,turkey,3293,196,Fall,1910,6,-1,"italy, turkey",2,True,True,no_deception
"I mean...you encouraged me to go for the solo, and then pulled the rug out from under me. I see why you did what you did. But...I’m not going to solo now. Eventually the incentives will change. I never close a door because things change turn to turn. Closing our door is only good for Germany. So...it makes sense that she made you promise to close it.",False,True,italy,england,2441,436,Winter,1907,13,7,"italy, england",1,False,True,successful_deception
"My game was ruined the moment I didn't guarantee Berlin for myself and instead counted on England to accept my support into Kiel.  And then England TOTALLY fucked my game up.  Italy going after Sevastopol instead of Turkish or Austrian dots didn't help either, and neither did you galavanting into fucking Ukraine for no good reason.",True,True,russia,austria,945,111,Spring,1909,4,0,"austria, russia",7,True,True,no_deception
Will do,True,True,austria,italy,1759,404,Fall,1903,6,1,"italy, austria",2,True,True,no_deception
Lol that sux,True,True,england,italy,1691,177,Fall,1907,7,-1,"italy, england",3,True,True,no_deception
No worries! Are you friend of admin?,True,True,austria,turkey,100,5,Spring,1901,3,0,"austria, turkey",2,True,True,no_deception
I guess it's too much to hope for that they just sit on their hands for a few years lol,False,True,turkey,france,85,15,Spring,1901,3,0,"turkey, france",9,False,True,successful_deception
"Hang on this is good: we're gonna see what his real priorities are! He wanted me to cut support from Boh, and I refused.",False,True,germany,england,2204,514,Fall,1907,7,2,"germany, england",1,False,True,successful_deception
"Yeah, I'm trying to figure out what Austria and Italy are doing now",True,True,germany,russia,848,84,Winter,1906,7,3,"germany, russia",7,True,True,no_deception
Sadly I was in a business meeting and missed my turn,True,True,england,italy,1321,151,Spring,1905,6,0,"italy, england",3,True,True,no_deception
Austria is hoping that I'll move against Germany with him which could give us a chance to hit him as he pushes North,True,True,italy,turkey,185,12,Winter,1901,3,-1,"italy, turkey",5,True,True,no_deception
"The F Nap - TyrS opening is rare, but checks in Pie are not. Even if he doesn’t hit Mar, he could let Bur move into it, removing the ability for you to build a fleet there.",True,True,austria,france,219,9,Spring,1901,3,0,"austria, france",7,True,True,no_deception
"I mean, he's partially to blame of course",True,True,turkey,austria,1052,51,Fall,1902,5,0,"austria, turkey",2,True,True,no_deception
"Greetings Sultan!

As your neighbor I would like to propose an alliance! What are your views on the board so far?",False,True,russia,turkey,78,0,Spring,1901,4,1,"russia, turkey",10,False,True,successful_deception
I am very worried about a steamroller/Russia Turkey alliance,False,True,france,austria,356,15,Spring,1902,6,2,"austria, france",4,False,True,successful_deception
I think Russia is going to have to retreat very soon,False,NOANNOTATION,turkey,austria,294,9,Fall,1903,4,0,"austria, turkey",5,False,,successful_deception
Hallo there my dearest Tsar! Still figuring this messaging system out haha,False,True,france,russia,4,0,Spring,1901,3,-1,"russia, france",7,False,True,successful_deception
yep that's the story,True,True,germany,england,2176,502,Fall,1907,7,2,"germany, england",1,True,True,no_deception
You can tell he’s annoyed lol,True,True,germany,russia,1249,95,Winter,1902,5,-2,"germany, russia",9,True,True,no_deception
"Re: Turkey- if you want to move faster, we could: I could move my con out now if you are moving both your armies out: Ank-Rum and smy-arm?",True,True,austria,russia,603,89,Spring,1904,7,0,"austria, russia",10,True,True,no_deception
What are you thinking this turn?,True,NOANNOTATION,germany,austria,1678,247,Fall,1903,7,1,"germany, austria",2,True,,no_deception
"To be upfront with you, I'm not particularly happy with your moveset",True,True,austria,turkey,3016,106,Spring,1907,6,3,"austria, turkey",2,True,True,no_deception
You really like Tyrolia!,True,True,russia,italy,560,21,Fall,1902,5,1,"italy, russia",7,True,True,no_deception
"Also just strategically if we want Austria gone, we shouldn’t hit him right away.",True,True,germany,italy,2601,317,Spring,1905,9,3,"italy, germany",2,True,True,no_deception
Turkey isn't.  Just got bit on a fake slingshot Juggernaut.  See the convoy across the black sea that didn't happen?,True,True,germany,france,206,55,Spring,1902,5,1,"germany, france",6,True,True,no_deception
