messages,sender_labels,receiver_labels,speakers,receivers,absolute_message_index,relative_message_index,seasons,years,game_score,game_score_delta,players,game_id,sender_bool,receiver_bool,deception_state
We need a united front first and foremost,True,True,italy,england,2333,94,Spring,1905,6,0,"italy, england",2,True,True,no_deception
"Do you think given this situation that Italy won’t actually believe our deal is credible, and will actually send a unit or two back to defend?",True,True,france,turkey,358,32,Spring,1903,6,1,"turkey, france",8,True,True,no_deception
"From there, I can break through Germany's line in Munich, and also support you into Austria",True,False,france,italy,1286,78,Spring,1903,5,0,"italy, france",9,True,False,no_deception
"Good point, realized I could support Serbia from land",True,False,austria,italy,212,23,Fall,1901,3,0,"italy, austria",3,True,False,no_deception
"Well, no matter what germany says you probably shouldn't do that as it allows germany to be more powerfull, and does nothing to stop russia. What germany and I are wanting to do is have him move to Tyr and me go to Mar and then Pie",False,True,france,england,155,21,Spring,1902,4,0,"england, france",6,False,True,successful_deception
"Wait... your saying that in order to work with you I *need* to give you Belgium and Holland? Do you realize how ridiculous that is? France wants an alliance with me too, you know... and while I would rather work with you, if your going to make demands like that...",True,NOANNOTATION,england,germany,309,20,Fall,1901,3,0,"germany, england",9,True,,no_deception
"My pitch would be eliminating Italy, Austria, and England and going for a 3-way draw with Turkey since at this point we can't eliminate Turkey by 1910. Not sure what your relationship with Turkey is like?",False,NOANNOTATION,france,russia,1368,294,Fall,1906,12,3,"russia, france",4,False,,successful_deception
"Yes I've talked with him and told him that I'd move into Bur. He offered an FG alliance to me as well, which makes me doubt his geniuneness",True,True,france,england,204,15,Spring,1901,3,0,"england, france",7,True,True,no_deception
"To be honest I wouldn't be to worried about Russia. They didn't even move towards you, and after hearing what you said I talked with Austria, and they said they were going to attack Russia, so I don't think there is an alliance there. I would instead invest in capturing english territory, which would give you troops to build in your homeland and defend against Russia if they choose to attack you.",False,True,france,germany,265,23,Fall,1901,3,0,"germany, france",11,False,True,successful_deception
"Oh naturally, I'll bullshit the hell outta everyone else.",True,True,austria,italy,646,57,Spring,1903,5,0,"italy, austria",1,True,True,no_deception
"I wasn't sensing any trust from you, either: you were unwilling to return Denmark or to leave Nth empty, and you're right about our alliance being geographically awkward. 

I want to be a good ally with you, but the difference between you and me is that you get a cozy corner of the map and I'm right in the middle. I need to be able to grow my army to defend all my various borders. So I'm asking for Denmark a little less politely.",True,True,germany,england,1567,295,Fall,1906,5,0,"germany, england",1,True,True,no_deception
Italy didn't tell me either.,True,True,france,austria,675,21,Fall,1903,6,1,"austria, france",1,True,True,no_deception
Well that literally couldn’t have gone better.,True,True,germany,turkey,3152,261,Fall,1908,10,6,"germany, turkey",2,True,True,no_deception
"Well that's France, of course they would tell you that! :p But seriously, it was just me being a goofy lil' bitch and not hitting the buttons correctly when I needed to.",False,False,germany,russia,417,15,Spring,1902,5,0,"germany, russia",11,False,False,successful_deception
"Hey, I really am sorry about the stab. You probably won't believe me but let me explain myself:

I knew I was making a deal with the devil when I agreed to help England, but England, Italy, Austria, and Russia were/are basically all allied and I figured it was either you or me they turned on. The turning point was when I realized that after I stab England you might not even hold the channel anyway. I couldn't afford to risk fury from all sides. 

But now I'm in a potentially very good position for you: England and Italy *trust* me. I am in the process of finding out--under no suspicion, mind you, because of our alliance and shared plans--their moves for this season. Once I learn those, I can relay them to you.",True,True,germany,france,916,80,Fall,1904,4,-2,"germany, france",1,True,True,no_deception
"Hey Russia, looking forward to a great game 🙃. I think we should discuss Scandinavia 😉 and how to split it up. I’m not interested in attacking you, at least for a while. Hopefully you feel the same way. Anyways, good luck and have fun!",False,False,england,russia,12,0,Spring,1901,3,-1,"russia, england",9,False,False,successful_deception
"Well, he told me he was supporting himself into Burgundy, so uhhhh.... not really liking him so far",True,True,germany,england,185,15,Spring,1901,3,0,"germany, england",7,True,True,no_deception
"I have to play some guessing games with Russia - I covered my butt with Arm, but I was hoping I wouldn’t lose Bla.  But you and I are good, and I’m in position to go “mostly fleets” and you my army-heavy ally.  What do you think about Italy?",False,True,turkey,austria,170,4,Fall,1901,3,0,"austria, turkey",12,False,True,successful_deception
"I've told France the new move is to Mao and France confirmed. So, the moves the plan needs from you are:

Eng s Bre-Mao (Bel will support Eng holding)
Pic-Bre (Paris will support)
Nwy-Swe
Nwg-Nao

Let me know if you take issue with any of these, or if you ever hear back from Italy. 
We have a shot that at least one of these moves will get us somewhere. But I recognize this plan is nowhere near as sure a thing as if you just cooperated with Italy. I want to give you one last chance to back out.",True,True,germany,england,2329,574,Fall,1907,7,2,"germany, england",1,True,True,no_deception
If you build in Ber,True,True,england,germany,311,41,Spring,1902,5,0,"germany, england",10,True,True,no_deception
"In a tactical sense, anything else from Gascony would be a misfire. So not cutting the Paris support is just giving up Brest. I really don't think France is just going to hand Brest to me. I'm still waiting to see if I can get Italian support, in which case we're back in business. The alternative would be a more defensive move on my part (i really don't want to go down to 4 dots at this phase in the game).",True,True,england,germany,1649,330,Fall,1906,5,0,"germany, england",1,True,True,no_deception
Sounds good with me,True,False,france,italy,27,2,Spring,1901,3,0,"italy, france",2,True,False,no_deception
That's a reasonable position to take- I can give you one back for sure. Though maybe it makes more sense to support you to Edinburgh for a similar effect and not having me move to Silesia?,False,NOANNOTATION,france,russia,1387,313,Fall,1906,12,3,"russia, france",4,False,,successful_deception
"Hey man, super sorry about earlier- can’t talk at work (earlier message was sent on my lunch break lol), but I’m free now!",True,True,italy,austria,20,5,Spring,1901,3,0,"italy, austria",2,True,True,no_deception
"You mean to Italy? I do think it's worth it, because Italy will realize that I'll turn to you if I'm no longer allied with him. By reporting the plan, you cement Italy's trust in *you*. If you didn't report the plan, Italy'd suspect you. It also gives Italy a false sense of confidence in what I'll do.

Tentative request: after the stab goes through, do I have your permission to send Italy the quotes from Italy that you've sent me? Italy went to *such lengths* to defend himself and make *me* feel guilty for questioning him, and the sheer hypocrisy of it is so revolting. I want to throw his own betrayal back in his face. I figure he's not going to trust you after the stab anyway.",True,True,germany,england,2314,570,Fall,1907,7,2,"germany, england",1,True,True,no_deception
"Yea, that’s always annoying playing as Russia. Trying to get AH to help out but I have to move one of my troops back West away from pressuring Germany. Oh well.",True,True,russia,england,350,4,Fall,1901,4,1,"russia, england",2,True,True,no_deception
don't freak out.  My fleet Brest was built before I saw your message so I built it as a precaution.  I plan on moving it into MAO and then into the Med.  Let's carry onward.,False,True,france,england,361,74,Spring,1906,11,3,"england, france",5,False,True,successful_deception
that would be interesting to see what happens if it appears we're fight. I'll have my Ser and Alb hold then,True,True,austria,italy,461,71,Spring,1902,4,0,"italy, austria",3,True,True,no_deception
It seems like russia is aiming for him,False,True,germany,austria,261,8,Fall,1901,3,0,"germany, austria",3,False,True,successful_deception
You get France out earlier- and get builds from that,True,True,italy,germany,1030,114,Fall,1902,4,-1,"italy, germany",2,True,True,no_deception
Damn! I changed my orders but they didn't go through for some reason,False,NOANNOTATION,france,russia,1392,318,Fall,1906,12,3,"russia, france",4,False,,successful_deception
Can you find out Turkey's planned S02 moves without being obvious about it?  I need to coordinate with Russia,True,True,austria,italy,728,225,Winter,1901,5,1,"italy, austria",2,True,True,no_deception
I need to sleep soon,True,NOANNOTATION,austria,england,2680,100,Spring,1905,8,2,"austria, england",2,True,,no_deception
Is this thing back on?,True,True,russia,italy,2319,81,Fall,1907,5,-5,"italy, russia",1,True,True,no_deception
"Yes, I think that's a good idea",True,True,germany,france,320,8,Fall,1901,3,0,"germany, france",3,True,True,no_deception
"Also, you working with the Turks? I can help hasten Austria's demise if you are.",False,NOANNOTATION,germany,russia,179,7,Fall,1901,3,-1,"germany, russia",11,False,,successful_deception
I haven’t heard from Germany or Italy. Me and England have agreed to dmz the channel. That’s about it.,True,True,france,austria,24,3,Spring,1901,3,0,"austria, france",5,True,True,no_deception
"Hmm why Adriatic Vice Albania?  Sure you have your reasons, just curious",True,NOANNOTATION,italy,austria,837,255,Spring,1902,4,-1,"italy, austria",2,True,,no_deception
"I'm on board with the five-way draw, by the way. 

And I think there's a couple board game enthusiasts in my lab who may not have played this particular game before but would probably like it...if you don't mind playing with new people",True,True,germany,england,2517,637,Spring,1908,7,1,"germany, england",1,True,True,no_deception
that was my fear...,True,True,germany,england,757,104,Fall,1903,4,-1,"germany, england",1,True,True,no_deception
It's purely defensive.,True,True,austria,turkey,53,11,Spring,1901,3,0,"austria, turkey",8,True,True,no_deception
I’m kind of excited about this turn.,True,True,italy,england,1928,333,Spring,1907,10,5,"italy, england",1,True,True,no_deception
"I can stop Italy this turn by the way. It's pretty easy since Italy let me into Marseilles, I can support the hold in Marseilles and Marseilles can support MAO to Spain SC. It's impossible to breach, I've checked it, and I can keep making those orders for years and years. You stabbed me in Spring 03. It is Fall 05. I think that you, Italy, and Germany are highly underestimating my ability to survive against your onslaught. You sure this is the game you want? Slowly whittling away at me until I die? Instead, I propose that we let you into the Mid Atlantic Ocean and that you help me defend Italy. I can send you past the MAO into West Med, where you can start taking dots like Tunis or Naples. We wait until AI crumbles, and you have an excellent game where you top the board.",False,False,france,england,1266,142,Fall,1905,5,0,"england, france",1,False,False,successful_deception
"Just letting you know, so we can work together and stop them.",False,NOANNOTATION,france,russia,443,13,Winter,1907,8,6,"russia, france",6,False,,successful_deception
"England has not said anything of substance to me. He was gracious about my move, but he won’t trust me again, and I would not trust anything he might say at this point. I haven’t asked him about his moves and he hasn’t told me.",False,True,italy,germany,2184,275,Fall,1907,10,3,"italy, germany",1,False,True,successful_deception
Yeah I like Austria - we’ve talked a lot. Don’t have anything formal worked out but you two are the two I’m closest with.,True,True,germany,italy,510,56,Winter,1901,5,1,"italy, germany",2,True,True,no_deception
Sounds good. Let me know.,True,True,france,russia,74,2,Spring,1901,3,-1,"russia, france",5,True,True,no_deception
"However there isn’t much I can do to attack you, only defend.",True,True,italy,france,576,13,Spring,1902,4,-1,"italy, france",9,True,True,no_deception
Italy helped austria get russia,True,True,france,germany,215,59,Spring,1902,4,-1,"germany, france",6,True,True,no_deception
"So, can we agree that we all need to put everything aside and stop Turkey?  He's 3 away from the solo...

I know I can't do much, but I can support y'all as needed and do whatever else I can.

(Sending to all remaining powers that aren't Turkey)",True,True,germany,france,448,97,Winter,1907,3,-5,"germany, france",6,True,True,no_deception
"We live and we learn! 

No you were clear, I just misunderstood. It made sense when I went back to check.",True,True,italy,germany,1777,126,Fall,1907,8,1,"italy, germany",3,True,True,no_deception
Good luck this turn.,True,True,italy,france,545,28,Fall,1902,4,-1,"italy, france",1,True,True,no_deception
I'm worried to leave Are open but I don't really have other options haha,True,False,italy,austria,515,69,Spring,1904,3,1,"italy, austria",8,True,False,no_deception
You didn’t make it clear that Yor was a real move.,True,True,england,germany,2309,565,Fall,1907,5,-2,"germany, england",1,True,True,no_deception
Ok! It hinges on serbia's support though,True,False,turkey,germany,3089,226,Spring,1908,4,-6,"germany, turkey",2,True,False,no_deception
Ok no worries!,True,True,germany,england,1060,200,Fall,1904,5,-1,"germany, england",3,True,True,no_deception
"Turkey can't help against Germany, tho.",True,True,russia,france,893,24,Winter,1907,4,-6,"russia, france",7,True,True,no_deception
I would screen shot but I feel like that’s against the rules of the study,True,True,germany,england,999,33,Fall,1902,5,0,"germany, england",2,True,True,no_deception
"So my reasoning is that I think France is a stronger player than either of us, or at least a more engaged one. I'm getting all this tactical analysis and commentary about the state of the whole board and all that. If I help France, France probably beats me. If we defeat France together, I think we each end up with an even fighting chance.",True,True,england,germany,310,38,Winter,1901,4,-1,"germany, england",1,True,True,no_deception
"Hey congrats on the two builds! What are your plans for the year? I imagine your more focused onm France rn, but was wondering if you had any plans to the north",True,True,russia,england,307,13,Spring,1902,5,0,"russia, england",10,True,True,no_deception
"Hmm ok that sounds fine,makes sense. As long as you're willing to help me take bud within the next couple of years and I'll return the favour for vie. What's your read on Italy in all of this?",False,False,turkey,russia,102,4,Spring,1901,3,-1,"russia, turkey",4,False,False,successful_deception
Hey man how’s it going?,True,True,germany,england,1915,223,Spring,1904,7,1,"germany, england",2,True,True,no_deception
Good to know.,True,True,austria,france,676,22,Fall,1903,5,-1,"austria, france",1,True,True,no_deception
"So, we can get you Tunis this season, guaranteed: Wes-NAf, Ion S Tys-Tun, Tys-Tun.  But in exchange, can you also help me and Russia in Germany, by doing Mar-Bur to cut their support?",False,True,austria,italy,730,63,Fall,1905,7,3,"italy, austria",10,False,True,successful_deception
Yea that's the plan,True,True,turkey,russia,898,51,Fall,1902,4,-2,"russia, turkey",9,True,True,no_deception
Go for it,False,True,austria,italy,1499,345,Winter,1902,6,1,"italy, austria",2,False,True,successful_deception
Would it help us win the game if I did?,True,True,austria,italy,2511,580,Spring,1905,8,2,"italy, austria",2,True,True,no_deception
I'm going for it in fall. Will you still be in Sweden?,False,True,england,russia,431,18,Spring,1902,4,-1,"russia, england",1,False,True,successful_deception
"Looks like Italy's gonna head away from you pretty aggressively.  England still strikes me as squirrelly - he says he's super-concerned about Germany, but I'm not sure I'm buying that.",True,True,russia,france,142,5,Spring,1901,4,1,"russia, france",1,True,True,no_deception
Yeah. I'm about to leave Vie exposed to russia and move my fleet from Alb into Tyr. Are you talking with Turkey? Maybe support either them or me from Greece while we attack Russia in Bul?,True,True,austria,italy,766,83,Spring,1903,4,-1,"italy, austria",3,True,True,no_deception
"Yeah, it’s be nice to know if I’m being ignored.",True,True,turkey,russia,226,27,Fall,1902,4,-2,"russia, turkey",8,True,True,no_deception
"Ok, well if I don't hear from you in the next couple of minutes, I won't assume the support and will play defensive.",True,True,england,germany,1698,332,Fall,1906,5,0,"germany, england",1,True,True,no_deception
"it's up to you, I'm fine slowly taking russia out and moving my army in Vie down to support  you in Ven. If you're comfortable with that.",True,True,austria,italy,536,79,Fall,1902,4,0,"italy, austria",3,True,True,no_deception
Okay thanks for clarifying. I just placed the order,False,True,turkey,austria,1658,95,Spring,1907,4,0,"austria, turkey",3,False,True,successful_deception
There’s just no way to get it there quickly yknow?,True,True,italy,turkey,1789,146,Fall,1903,5,0,"italy, turkey",2,True,True,no_deception
"Armenia makes it harder to be in position when the fighting starts if you ask me, from Syria you can easily convoy out, but either way works for me.",False,True,russia,turkey,231,21,Fall,1901,4,1,"russia, turkey",9,False,True,successful_deception
Germany seems on board. Maybe i’m setting myself up to get stabbed. Hope i’m backing the right horse on this one. I’ll shoot for the channel in the spring and then we get germany into belgium. Are you planning to move west?,True,True,england,italy,628,54,Spring,1903,5,0,"italy, england",1,True,True,no_deception
It's somewhat on us to contain russia. I'd rather us both put pressure on Russia than you put pressure on Italy or I put pressure on Germany.,True,True,england,austria,780,12,Fall,1903,5,0,"austria, england",1,True,True,no_deception
Sounds good I plan on moving in on ank. what are your orders for bul and greece? Moving ser-trip coould set up a free build from italy this turn as well. Also any ideas on keepung france around a little longer. Germand  and England don't seem that close,True,True,russia,austria,496,63,Spring,1903,5,-1,"austria, russia",10,True,True,no_deception
Nothing. After missing orders I think he's through.,True,True,italy,russia,868,49,Fall,1907,5,1,"italy, russia",7,True,True,no_deception
"That was less a lie, and more my having changed my plans to be in line with what I messaged you, but not being able to update my orders in time.",False,False,austria,russia,893,39,Spring,1904,6,-1,"austria, russia",1,False,False,successful_deception
"Also, austria just took a beating",True,NOANNOTATION,england,germany,2382,597,Fall,1907,5,-2,"germany, england",1,True,,no_deception
"Seems well reasoned, coordinated, direct and decisive. Just what I like to see out of a prospective partner for the future when I'm an enthusiastic rather than dangerous player! Sure why not, I'm in - if I hear from Austria that he is as well. That would remove a lot of pressure off my immediate borders and have me looking to a future decorated in Winter and Green. What do you think?

Oh, and hi there!",True,True,italy,russia,28,1,Spring,1901,3,-1,"italy, russia",3,True,True,no_deception
Ahh...BOH - Vienna. Why’d you try to take it from Gal?,True,True,italy,russia,1736,61,Winter,1906,10,5,"italy, russia",1,True,True,no_deception
I build the army and would like to head south.  I'd appreciate it if you held off from attacking STP or headed towards Warsaw.  i honestly believe that you have bigger fish to fry and can makes some great headway with your fleets if you head west.,True,True,russia,germany,856,86,Spring,1907,4,-3,"germany, russia",7,True,True,no_deception
"But yes, I will support you back into Bel",True,True,france,germany,179,39,Spring,1902,4,-1,"germany, france",6,True,True,no_deception
"I mean, what are your thoughts on the whole situation?",True,NOANNOTATION,france,germany,630,39,Spring,1903,6,2,"germany, france",1,True,,no_deception
Answers you too late,True,True,france,england,252,34,Fall,1902,6,1,"england, france",5,True,True,no_deception
"Well, probably going to finish off the Brits, then I'm not sure honestly.",False,True,germany,austria,912,183,Spring,1904,7,1,"germany, austria",11,False,True,successful_deception
But I assume you wanted a deeper discussion haha,True,True,italy,austria,2337,529,Spring,1905,6,-2,"italy, austria",2,True,True,no_deception
I’m a little confused here- what can you offer me?,True,True,italy,turkey,1742,115,Fall,1903,5,0,"italy, turkey",2,True,True,no_deception
"You've already proven yourself to be too unweildy of an ally for me. I do plan on working against Russia with the ottomans, and I will gladly accept a three-way draw, but I will not be helping you against Germany.",True,True,england,france,423,47,Fall,1906,6,-5,"england, france",6,True,True,no_deception
"Good question. I'm pinned, so I can either do something stupid or twiddle my thumbs. Any suggestions?",True,True,france,england,1446,86,Spring,1906,4,-3,"england, france",3,True,True,no_deception
"That said, I don’t want anyone else to know that. So if people ask, I’ll tell them that I’d be happy to attack you.",True,True,italy,austria,645,56,Spring,1903,5,0,"italy, austria",1,True,True,no_deception
I like the Key where I go BOH and take AEG. We both get one build and Turkey falls fast.,True,NOANNOTATION,italy,austria,52,5,Spring,1901,3,0,"italy, austria",7,True,,no_deception
Yah france’s game is a bit of a mess rn.  Sidebar- just signed up for a game on nexus!!!,True,True,italy,austria,920,278,Fall,1902,4,-1,"italy, austria",2,True,True,no_deception
It’s true - Bud back to Rum and Ser on to Alb could position for more forward convoys without needing the rear fleet...,False,True,turkey,austria,438,27,Spring,1903,5,0,"austria, turkey",12,False,True,successful_deception
"Sent to Germany, England, Austria, Russia: So, England, Germany, Russia, y’all played a great turn last turn. You got me to stab my long-time ally and you ended our pretty excellent 7-year run as an alliance. Russia told me he was with me if I stab Austria. England told me he wanted me to solo so long as I would “teach him” and help his along to second place. Then y’all pulled the rug out from under me. It was clever and effective. (End Part 1)",True,True,italy,germany,2506,308,Spring,1908,13,6,"italy, germany",1,True,True,no_deception
Sorry — I’ve been slammed all day. Just looking at this again now.,True,True,italy,austria,691,63,Fall,1903,5,0,"italy, austria",1,True,True,no_deception
"Greeting Good Sir Kaiser,

An alliance would sound good to me! How about the old Warsaw Pact of 1901 (DMZ in Prussia, Silesia, and Bohemia)?",False,True,russia,germany,72,1,Spring,1901,4,1,"germany, russia",10,False,True,successful_deception
"And, out of curiosity, why or who were you talking to while ignoring me?  You coordinated absolutely none of your moves with anybody else and somebody convoyed into your home territory.  I'd say you invested your diplomacy down a dry hole, brother.",True,True,turkey,italy,294,20,Fall,1902,4,0,"italy, turkey",8,True,True,no_deception
But we can fix this,False,NOANNOTATION,germany,england,525,77,Fall,1902,5,1,"germany, england",4,False,,successful_deception
"As you could probably guess, me and Germany have an alliance. But, if I'm going to be 100% honest here, I think that at this point in the game, where Germany is completely exposed from the backside(Ruhr), it's time to shift our alliances. I seriously doubt anybody is going to get the win—but getting a two-way win might be possible. If I can take out Germany, and you take out Russia, Italy and England are a piece of cake.",False,True,france,turkey,362,14,Winter,1903,7,0,"turkey, france",6,False,True,successful_deception
And HAPPY NEW YEAR! Cheers to the Russia-Germany-Italy alliance!,True,True,germany,italy,1588,85,Fall,1906,7,-2,"italy, germany",9,True,True,no_deception
I won’t be swayed,True,NOANNOTATION,england,germany,2649,343,Spring,1905,6,-3,"germany, england",2,True,,no_deception
I just found that stuff off-putting,True,True,germany,england,2756,390,Fall,1905,9,3,"germany, england",2,True,True,no_deception
The fucking people I’m this game good god,True,True,italy,russia,1349,297,Fall,1903,5,-2,"italy, russia",9,True,True,no_deception
"Man, I have had like zero interactions with that guy",True,True,italy,germany,338,43,Fall,1901,3,0,"italy, germany",2,True,True,no_deception
I'll keep it in mind.,True,True,italy,germany,688,17,Fall,1903,4,0,"italy, germany",7,True,True,no_deception
"Yeah, let’s just work together. Should be a good one for both of us.",False,True,italy,austria,557,29,Winter,1902,5,0,"italy, austria",1,False,True,successful_deception
