messages,sender_labels,receiver_labels,speakers,receivers,absolute_message_index,relative_message_index,seasons,years,game_score,game_score_delta,players,game_id,sender_bool,receiver_bool,deception_state
Ok just to be really specific about it: Can we agree on the story that we ceased communications. You said we’re not a good match and I said “suit yourself” and that was it? And can we also promise to not make the communication obvious without saying it exactly (e.g. “someone told me xyz” when only I could have known). And to be clear i’m agreeing to the confidentiality as well.,True,True,england,germany,1982,386,Spring,1907,5,-2,"germany, england",1,True,True,no_deception
"Looks like I had bad information, which is too bad since I will be losing Munich",False,True,france,turkey,475,17,Fall,1902,6,1,"turkey, france",4,False,True,successful_deception
"So, I’ll move the fleet to Liverpool. And you want MAO to support Paris to Brest?",False,True,italy,germany,2126,263,Fall,1907,10,3,"italy, germany",1,False,True,successful_deception
"Yeah you have before.  We both have. I guess I figured it’d end up that way anyway, and “it’s easier to ask for forgiveness than permission”, as lame as that sounds.",False,False,turkey,russia,946,385,Winter,1907,13,2,"russia, turkey",12,False,False,successful_deception
Can you ask Germany to bounce Russia in sweden?,True,True,austria,italy,418,149,Fall,1901,3,0,"italy, austria",2,True,True,no_deception
"My inclination is to focus south. I won't put an army in StP, you don't put an army in Norway. Fair deal?",True,True,russia,england,34,3,Spring,1901,4,1,"russia, england",5,True,True,no_deception
"I agree with all that. I’m just trying to tease out who he’s lying to, as that may provide some advantage. Honestly he’s been more pro-English than anti-German in his communications with me. I think he maybe just doesn’t want me to go tattle to you though.",True,True,england,germany,1601,313,Fall,1906,5,0,"germany, england",1,True,True,no_deception
"Sure, that's reasonable. I think it will be an interesting year",True,NOANNOTATION,france,austria,886,10,Fall,1902,5,0,"austria, france",9,True,,no_deception
"Yeah, it is, because it means that Austria has no friends and is doomed to die first. I hate it and almost prefer to do a key Lepanto over a hedgehog.",True,True,austria,russia,269,25,Fall,1901,3,-1,"austria, russia",7,True,True,no_deception
well what should we do about that?,True,True,germany,england,279,13,Fall,1902,5,1,"germany, england",8,True,True,no_deception
While keeping Russia in my pocket,True,True,austria,italy,794,236,Spring,1902,5,1,"italy, austria",2,True,True,no_deception
Literally just have an unopened message,True,True,germany,italy,1537,198,Winter,1902,7,2,"italy, germany",2,True,True,no_deception
The question in my mind is how I get into IonS.,True,True,austria,italy,187,21,Spring,1901,3,0,"italy, austria",7,True,True,no_deception
I’d probably just use the army to protect Liverpool. I’d send NAO to Norwegian if the battle is going to be against Germany. And I’d flip a coin between supporting Channel to Belgium or supporting Denmark holding.,True,True,italy,england,1558,214,Fall,1906,8,3,"italy, england",1,True,True,no_deception
So...any thoughts on how to approach this?,True,True,italy,germany,1111,83,Spring,1905,7,2,"italy, germany",1,True,True,no_deception
Perhaps? Seems like an error of not enough foresight if that's the case.,True,True,russia,france,642,104,Spring,1902,6,1,"russia, france",9,True,True,no_deception
"I know russia just asked me for help to split you if we weren't doing a lepanto. I said, ""He cant stop us both!"" Which is true for you and Turkey. But I'm full in for the lepanto. I just have to say vague truths to Russia for now.",True,True,italy,austria,397,48,Spring,1902,4,0,"italy, austria",7,True,True,no_deception
Might I recommend striking back with your last dying breath? Join me and destroy Italy.,True,True,austria,france,1787,5,Winter,1907,2,0,"austria, france",3,True,True,no_deception
Yeah I’ll probably lose Ber but that sounds about as good as I could figure out too.,True,True,germany,england,797,148,Spring,1908,7,-3,"germany, england",10,True,True,no_deception
Now that is dealt with I think we should consider future moves,True,True,turkey,france,369,9,Spring,1907,8,-5,"turkey, france",5,True,True,no_deception
I'll get back with you on a for certain about Sweden. I trust my word means something to you by now,True,True,england,russia,625,63,Fall,1902,5,0,"russia, england",3,True,True,no_deception
done.  can we go our separate ways?,True,True,russia,germany,847,83,Winter,1906,4,-3,"germany, russia",7,True,True,no_deception
France I think. The A spa -Mar got stopped,True,True,turkey,germany,1113,49,Fall,1902,5,0,"germany, turkey",2,True,True,no_deception
Now that's just rude,True,True,austria,italy,1578,132,Fall,1906,5,-1,"italy, austria",3,True,True,no_deception
well i am going to watch the caps hockey game.  I will be back after to see what you have to say.. but any suggestion will have to go along with you trusting me to leave my army in gal.  in exchange you would have to help me somehow and if the trust holds then next year i could move out of gal.  anyhow. i will be back on probably around 10:30p,True,False,austria,russia,1165,36,Fall,1902,5,-1,"austria, russia",9,True,False,no_deception
Yes sorry I had forgotten to thumbs up my reply.,True,True,germany,england,771,137,Spring,1907,5,-5,"germany, england",10,True,True,no_deception
Haha no need to worry,False,True,germany,england,953,164,Spring,1904,5,-1,"germany, england",3,False,True,successful_deception
Alright excellent. Sounds good. We'll even it out. Promise that. I just want a healthy border around my home centers and a guarantee I can push back France,False,True,germany,england,258,50,Fall,1901,3,0,"germany, england",4,False,True,successful_deception
"Hey England, sorry I've been so long in reaching out.

Just wanted to make it clear that I hold no I'll intentions toward you, and my moves Spring 1901 should prove that. I will absolutely not be moving A MOS-STP, and I'd hope to consider you a welcome neighbor should you decide to take NWY in the future. We each stand to gain little by meddling in each other's business, I would be happy to leave you to your business in the West while I play in my own sphere of influence.

Best wishes and good luck!",False,True,russia,england,72,0,Spring,1901,4,1,"russia, england",6,False,True,successful_deception
"Now that Italy is out of the game, perhaps we can work on a strategy against Turkey?",True,True,austria,france,613,42,Fall,1904,2,-6,"austria, france",8,True,True,no_deception
I’m salty at ol austria/hungry but idk if we can turn the tide,True,NOANNOTATION,italy,turkey,1763,120,Fall,1903,5,0,"italy, turkey",2,True,,no_deception
"Full record:
F Bel S ENG

A Bur - Gas

F HEL - Kie

A Hol - Yor

A Mun - Tyr

F NTH C Hol - Yor

A Par S Pic - Bre",True,True,germany,england,2371,588,Fall,1907,7,2,"germany, england",1,True,True,no_deception
"That's true, and appreciated!",True,True,france,italy,986,48,Fall,1902,5,1,"italy, france",9,True,True,no_deception
Do you think that would work,True,True,italy,turkey,924,44,Fall,1902,4,0,"italy, turkey",9,True,True,no_deception
Yea sadly there's limits to our connection :/ hehe,True,True,england,germany,1859,411,Spring,1909,8,0,"germany, england",3,True,True,no_deception
I’m sorry. I’ve doomed us.,True,True,england,germany,745,120,Fall,1905,7,0,"germany, england",10,True,True,no_deception
You or I can have it long term. I just want Austria off the map.,True,True,turkey,russia,540,53,Spring,1904,6,1,"russia, turkey",8,True,True,no_deception
I'm not sure I can do that much but I'm happy to help,False,True,turkey,austria,106,10,Spring,1901,3,0,"austria, turkey",2,False,True,successful_deception
"All that makes sense and I believe it. I feel like your ""horse"" in the russian front is Austria's future strength, which could pose a threat to you. Your advice to me is consistent with that.",True,True,england,italy,1303,146,Fall,1905,5,-2,"italy, england",1,True,True,no_deception
"Yep, there are some guessing games, but I think we have the better position now.",True,True,austria,italy,706,62,Spring,1905,7,3,"italy, austria",10,True,True,no_deception
Actually for the spring turn it would be better to support swe.,True,True,england,russia,797,95,Spring,1903,7,2,"russia, england",3,True,True,no_deception
Both are doable and done,True,True,austria,italy,1596,372,Fall,1903,6,1,"italy, austria",2,True,True,no_deception
"I suggest the following:

Gas - Liv (via convoy)
Spa S MAO holding
Mar hold
Tyr - Tri

Hol - Yor (via convoy)
Bur S Bel
Bel S North
HEL S North
Mun - Boh
Par - Pic (to cut any potential support)",False,True,italy,germany,2111,254,Fall,1907,10,3,"italy, germany",1,False,True,successful_deception
War changes you.,True,True,russia,germany,2429,41,Winter,1907,5,-2,"germany, russia",1,True,True,no_deception
Germany seems like a bit of a wild card. Haven't talked in depth with Austria.,True,False,england,italy,107,3,Spring,1901,3,0,"italy, england",1,True,False,no_deception
https://tenor.com/view/why-huh-but-why-gif-13199396,True,NOANNOTATION,russia,italy,610,12,Fall,1904,5,2,"italy, russia",8,True,,no_deception
lol kk. Let's do this,True,True,austria,italy,812,248,Spring,1902,5,1,"italy, austria",2,True,True,no_deception
"Well, you are poised to take Norway, and I can bounce Russia out of Sweden. I'd like to take Holland, but you can have Belgium. Unfortunately France did get into Burgundy like he said, so he could either go to Munich or Belgium.",True,True,germany,england,232,21,Fall,1901,3,0,"germany, england",7,True,True,no_deception
"No, but I just started checking messages on this computer 🙂",True,True,france,england,1521,109,Spring,1906,4,-3,"england, france",3,True,True,no_deception
Haha well Turkey is now working with Russia so good luck in stopping that Russia train now haha,True,True,austria,france,214,7,Spring,1902,3,-1,"austria, france",6,True,True,no_deception
Good to know.,True,True,russia,england,472,32,Spring,1902,5,0,"russia, england",3,True,True,no_deception
I can’t agree to a deal where he keeps the North Sea. I just can’t have two armies sitting around doing nothing to be this guys friend.,True,True,germany,italy,1202,138,Fall,1902,5,1,"italy, germany",2,True,True,no_deception
It's all good!,True,True,russia,italy,221,21,Fall,1901,4,1,"italy, russia",3,True,True,no_deception
Ok. Nice work. Talk tmrow,True,True,france,germany,223,63,Spring,1902,4,-1,"germany, france",6,True,True,no_deception
"You can easily explain the build.  The fleet gives you more leverage against me, both in the short and long run",True,NOANNOTATION,austria,italy,742,227,Spring,1902,5,1,"italy, austria",2,True,,no_deception
"Great, glad we're on board !/",True,NOANNOTATION,england,france,110,8,Spring,1901,3,0,"england, france",5,True,,no_deception
"Sounds good! Yeah ill take Sil, threaten Ber, and bring that ank unit north.",True,True,russia,austria,709,114,Spring,1905,7,0,"austria, russia",10,True,True,no_deception
I think that Russia's game is simplest when Turkey doesn't exist. Don't worry about a juggernaut.,True,False,russia,england,39,7,Spring,1901,4,1,"russia, england",5,True,False,no_deception
I can settle for survival. Deal.,False,True,england,italy,1961,347,Spring,1907,5,-5,"italy, england",1,False,True,successful_deception
"In my view, the fleet going to SC of Spain is a concession to England, but apparently he doesn't see things the same way. I suggest that we demilitarize Western Mediterranean for now. My fleet will go on standby in Lyon to defend Marseilles",True,True,france,italy,578,14,Spring,1902,5,1,"italy, france",9,True,True,no_deception
"You could. I think it would be better to get Holland now and Denmark later though, since that would put more pressure on france and would also be more defensively sound.",False,True,england,germany,334,29,Fall,1901,3,0,"germany, england",9,False,True,successful_deception
When he declined the offer I said ok,True,True,england,germany,1392,311,Fall,1905,6,-1,"germany, england",3,True,True,no_deception
"Send that second fleet towards France and we should be fine 😉 I think you were planning on that anyway, so that shouldn't be too much of a pain",True,True,austria,italy,845,259,Spring,1902,5,1,"italy, austria",2,True,True,no_deception
Can you suppport me into Pie?,True,True,france,germany,286,78,Spring,1903,5,0,"germany, france",6,True,True,no_deception
Any chance that you realize your stab failed and that you’re gonna back off?,True,NOANNOTATION,england,france,737,50,Fall,1903,5,-1,"england, france",7,True,,no_deception
Sure,True,True,france,germany,1834,182,Spring,1907,1,-6,"germany, france",1,True,True,no_deception
Yes,False,True,england,austria,2674,94,Spring,1905,6,-2,"austria, england",2,False,True,successful_deception
"Okay, am I supporting you into Sweden? If you are covering St Pete I'd like to go Sweden to ensure England doesnt get it. Just let me know what to do.",True,True,germany,russia,424,38,Spring,1902,4,-1,"germany, russia",7,True,True,no_deception
"Wait, no. Venice to Tuscany is much better.",True,True,turkey,russia,838,149,Spring,1909,11,2,"russia, turkey",8,True,True,no_deception
"Ah thank you, I can do that",True,True,germany,france,870,31,Fall,1903,4,-1,"germany, france",3,True,True,no_deception
*okay to be clear plan is not on til I hear back from France. But *I'm* on board.,True,True,germany,england,2156,488,Fall,1907,7,2,"germany, england",1,True,True,no_deception
So- I guess we’ll revisit next turn?,True,True,italy,turkey,1784,141,Fall,1903,5,0,"italy, turkey",2,True,True,no_deception
"I’d still plan on moving into ION, it gives me more options.",True,True,italy,turkey,40,3,Spring,1901,3,0,"italy, turkey",9,True,True,no_deception
"Hi Russia, how’s it going? I hope this turn finds you well. 

I think my move is going to be fairly boring, but I’m still game for some adventure if you have any ideas. 

Also, would you mind asking Austria for a bounce again in Galicia? I’d just like to have a decent sense of what his units are doing. 

Any other thoughts?",False,True,italy,russia,210,12,Fall,1901,3,-1,"italy, russia",1,False,True,successful_deception
Do you truly want to be my ally?,True,True,england,russia,609,58,Fall,1902,5,0,"russia, england",3,True,True,no_deception
"As much as I love DQ, he isn't always right about everything.",True,True,england,russia,108,4,Fall,1901,3,-1,"russia, england",8,True,True,no_deception
"and I *assume* you meant you want support for Ukr-Rum, since you're doing Sev-Bla to keep Turkey out, right?  Because you didn't actually say which unit you were sending to Rum... would be very sad to order a support for the wrong unit, y'know?",True,True,austria,russia,269,29,Fall,1901,3,-1,"austria, russia",10,True,True,no_deception
"Hey now, I happen to quite like the French in reality lol",True,True,russia,italy,972,204,Fall,1902,6,2,"italy, russia",9,True,True,no_deception
But you’re doing well against Italy. He seems to have a hard-on for Smyrna,True,True,turkey,france,305,11,Fall,1902,4,-1,"turkey, france",8,True,True,no_deception
Austria is going to hedgehog though so I doubt we can get together soon.,False,True,italy,russia,133,9,Spring,1901,3,-1,"italy, russia",7,False,True,successful_deception
Armies in Kiel and Munich,True,True,germany,england,333,43,Winter,1901,5,1,"germany, england",1,True,True,no_deception
Has he made you any offers on Sweden?,False,True,england,germany,548,67,Fall,1902,5,0,"germany, england",3,False,True,successful_deception
So what are you saying?,True,True,germany,austria,2418,355,Spring,1905,9,1,"germany, austria",2,True,True,no_deception
"Idk, let me know what you think",True,NOANNOTATION,england,france,226,23,Spring,1902,5,-1,"england, france",5,True,,no_deception
Hey what’s up,True,False,italy,france,2195,17,Winter,1904,6,4,"italy, france",2,True,False,no_deception
Russia built where he did even though I said that would prove to me that he’s been acting in bad faith. We need France and England to acknowledge the juggernaut before they get to the stalemate.,True,True,austria,germany,660,20,Spring,1903,3,-1,"germany, austria",7,True,True,no_deception
"We were/are, yeah. But Englands position is not tenable. E made some mistakes when we were mopping up G and it just took too long.",False,True,france,russia,760,15,Spring,1906,6,-5,"russia, france",12,False,True,successful_deception
Understand this: I've been hammering away at Russia while you've been running around in the west and the Atlantic. I will do everything I can to make Moscow mine.,True,True,turkey,england,1257,86,Spring,1905,5,-1,"england, turkey",3,True,True,no_deception
I honestly don’t know what the heck France is doing to not even take Spain with their first turn one. That seems like a pretty obvious move. I would like Sweden for another supply center. You can take Norway. I may need to protect my southern flank more from Turkey who could cause problems.,False,True,russia,germany,303,6,Fall,1901,4,1,"germany, russia",2,False,True,successful_deception
Any word on if the Austrians are letting you have Greece?,True,True,russia,italy,261,42,Fall,1901,4,1,"italy, russia",9,True,True,no_deception
"Even with my help, you could still lose Denmark.",True,True,russia,germany,537,51,Fall,1902,5,1,"germany, russia",7,True,True,no_deception
If they felt comfortable I doubt they'd have bothered to build a fleet that can go directly to the Norwegian Sea rather than one that can almost immediately deploy to harass and/or support Belgium.,True,True,russia,france,625,95,Spring,1902,6,1,"russia, france",9,True,True,no_deception
Italy wants my support into France,True,True,germany,turkey,1118,54,Fall,1902,5,0,"germany, turkey",2,True,True,no_deception
But it looks like Germany now approves this attack,True,True,turkey,england,2770,49,Fall,1905,3,-3,"england, turkey",2,True,True,no_deception
updated to Nwy. More friendly to you.,True,True,england,germany,2039,436,Spring,1907,5,-2,"germany, england",1,True,True,no_deception
I’m not really sure. I hope we can can see this to the end.,True,True,england,germany,1322,91,Fall,1902,5,0,"germany, england",2,True,True,no_deception
"Well, I dunno, it sounds like I should stab you. Is that what you’re trying to tell me?

I like you. I like how hard you’ve worked in this game to rebound from a difficult start. I like that you e told me the truth, even when the news was bad. I like that you tell me when you don’t trust me. I have literally never told you a lie in this game, and I don’t intend to start now. Last turn I burned my bridge with England beyond repair. If you don’t want to work with me now, that’s really disappointing.",False,True,italy,germany,2067,245,Fall,1907,10,3,"italy, germany",1,False,True,successful_deception
Italy is on board.,False,True,russia,turkey,873,51,Fall,1903,5,-1,"russia, turkey",4,False,True,successful_deception
"I mean he said ""here's what I suggest: [the moves you sent me just now]"" and I said ""okay sure!"" because deception is important in this game, i'm told. Then he told you the moves, then you told them to me! 
But because he suggested leaving Bel undefended and you *warned* me about it, I had made up my mind in that moment.",False,True,germany,england,2140,482,Fall,1907,7,2,"germany, england",1,False,True,successful_deception
I suggest you retreat to Skagerrak to put maximum pressure on Germany.,True,True,italy,england,1955,341,Spring,1907,10,5,"italy, england",1,True,True,no_deception
?,True,True,england,russia,572,48,Fall,1902,5,0,"russia, england",3,True,True,no_deception
Oh and happy thanksgiving!,True,True,italy,austria,107,13,Fall,1901,3,0,"italy, austria",8,True,True,no_deception
"Not sure, waiting on a reply.",True,False,italy,england,1351,153,Fall,1905,6,0,"italy, england",3,True,False,no_deception
"Gotcha. I’m playin dnd this weekend, but i’m not sure that quite counts as having a life). I’ll probably be mostly offline through sunday evening just cause i really need a break from this game",True,True,england,germany,1628,327,Fall,1906,5,0,"germany, england",1,True,True,no_deception
"Ooh, post-coffee now.  So, you've opened north.  I'm focusing south.  I really don't want to have to spend a lot of time and effort covering my northern dots. So what can we do to keep tensions low up there?",True,True,russia,england,120,6,Fall,1901,4,1,"russia, england",8,True,True,no_deception
"Like ... how far? Cause you need friends, and Italy and Russia (I assume) both lies to you and attacked you. Me? I prefer to find a partner that I’m a principled negotiator. I like to find a partner with whom I can negotiate in good faith. And work with long term.  

A fleet in Greece is great for attacking Turkey, not so much against Italy.  If we have three fleets against two Italian fleets, we can take him.  Quick. Also, if I’m in the Black Sea, I can help you against Rumania. 

I’d ask you to consider this - you can gain two neutrals and lose one of your home centers for a net of four. Or, you can protect your home centers, gain, one, and get position on the guy who attacked you ... and earn an ally. I think that’s a very fair prospect.",True,False,turkey,austria,136,28,Fall,1901,3,0,"austria, turkey",8,True,False,no_deception
"Okay, I’m so sorry. I got distracted again. Yes! I will order GRE to SMY, EAS S GRE to SMY, TYR S MUN holding. 

Will you allow me a build this turn or do you plan on retaking Greece now?",False,True,italy,austria,697,64,Fall,1903,5,0,"italy, austria",1,False,True,successful_deception
I would also love to see us dislodge England from the North Sea.,True,NOANNOTATION,germany,russia,1281,99,Spring,1903,5,-2,"germany, russia",9,True,,no_deception
My fear is the fleet in London taking the North Sea,True,True,germany,russia,1501,140,Fall,1904,5,-5,"germany, russia",9,True,True,no_deception
Did he say it in a threatening way???,True,True,italy,germany,2522,278,Spring,1905,6,-3,"italy, germany",2,True,True,no_deception
I don’t.,True,True,germany,england,1160,70,Fall,1902,5,0,"germany, england",2,True,True,no_deception
Thanks. Are you still planning on attacking me or just letting me know about the second attack?,True,NOANNOTATION,germany,russia,735,30,Fall,1905,7,0,"germany, russia",10,True,,no_deception
"Ok cool. Yeah, if we are able to ward off Russia successfully, we can figure out a plan to split his supply centers fairly between us",True,True,germany,austria,789,31,Spring,1903,4,0,"germany, austria",3,True,True,no_deception
Yeah I'm gonna die. Not much I can do about it.,True,True,italy,russia,874,55,Fall,1907,5,1,"italy, russia",7,True,True,no_deception
"What makes you think that Germany doesn't ""like"" me?",True,True,russia,italy,107,3,Spring,1901,4,1,"italy, russia",7,True,True,no_deception
"Yes, it does look like R has too many bases to cover",True,NOANNOTATION,austria,turkey,250,45,Fall,1902,4,0,"austria, turkey",8,True,,no_deception
"That’s wonderful news. We’ve spoken a bit. He doesn’t seem particularly committed to england, but the two of them have been speaking.",True,True,germany,russia,523,32,Spring,1902,5,-1,"germany, russia",9,True,True,no_deception
F Nrwy - NwgS,True,True,england,germany,327,48,Spring,1902,5,0,"germany, england",10,True,True,no_deception
He’s incommunicado,True,True,england,italy,938,16,Fall,1902,5,1,"italy, england",2,True,True,no_deception
FOH,True,True,italy,russia,1293,286,Spring,1903,5,-2,"italy, russia",9,True,True,no_deception
Norway is intriguing.  I wish I was in STP right now.  😦,False,NOANNOTATION,russia,germany,505,44,Fall,1902,5,1,"germany, russia",7,False,,successful_deception
Maybe you will able to broker a deal with France and refocus on Austria?,True,True,turkey,italy,536,34,Winter,1901,5,1,"italy, turkey",2,True,True,no_deception
I’d like to have your final thoughts on A/R as quickly as possible so that I have time to execute a plan. But I understand if you want time to think about it.,True,True,italy,england,1805,269,Spring,1907,10,5,"italy, england",1,True,True,no_deception
"I'm considering moving into the aegean and pressing into greece, but nothing definite yet",True,False,turkey,germany,1814,20,Spring,1908,6,-1,"germany, turkey",3,True,False,no_deception
"I agree. Running through some tactics, I see that Italy can hold his western dots until he's forced to disband. I think we'll need to see two disbands, maybe three, before we can break through.",True,True,england,russia,2437,70,Winter,1907,6,1,"russia, england",1,True,True,no_deception
Lmfao,True,True,germany,austria,2529,429,Spring,1905,9,1,"germany, austria",2,True,True,no_deception
I mean I’m pretty much at your deposal,True,True,germany,france,487,27,Winter,1901,5,0,"germany, france",9,True,True,no_deception
Yep 👍,True,True,turkey,italy,899,37,Fall,1902,4,0,"italy, turkey",9,True,True,no_deception
"And I hate to be so greedy to open up but I'm nervous that if I forego a build it opens me up to have Russia, France or both collapse on me and then we're really fucked. Particularly if France walks into Munich, I'll need both builds badly",False,True,germany,england,232,35,Fall,1901,3,0,"germany, england",4,False,True,successful_deception
"He has some justification to be worried about Russia, considering that Russia hit Norway in force and England won't be able to recover it",True,True,france,italy,998,55,Fall,1902,5,1,"italy, france",9,True,True,no_deception
Has he contacted you? And I'm not sure. I don't think he'd be that aggressive right from the start. I can't say I know for sure. What do you want to do?,False,True,germany,france,141,7,Spring,1901,3,0,"germany, france",4,False,True,successful_deception
